{
  "fsp": "1.0",
  "party": {
    "role": "operator",
    "id": "sklad-24",
    "name": "Склад 24",
    "contact_channel": "mailto:sales@sklad24.example"
  },
  "modules": {
    "core": { "versions": ["2.1"] },
    "pricing": { "versions": ["1.3"], "level": "L1" },
    "capacity": { "versions": ["2.1"] }
  },
  "updated_at": "2026-09-30T10:00:00+03:00"
}
