{
  "fsp": "1.0",
  "party": {
    "role": "aggregator",
    "id": "mpfit",
    "name": "МПФИТ",
    "contact_channel": "https://mpfit.ru"
  },
  "modules": {
    "core": { "versions": ["1.0"] },
    "pricing": { "versions": ["1.0"], "level": "L3", "read_only": true },
    "capacity": { "versions": ["1.0"], "read_only": true },
    "quote": { "versions": ["1.0"] }
  },
  "endpoints": {
    "quote": "https://api.mpfit.ru/fsp/v1/quote"
  },
  "updated_at": "2026-07-25T10:00:00+03:00"
}
