{
  "fsp": "1.0",
  "party": {
    "role": "operator",
    "id": "sklad-vostok",
    "name": "Склад Восток",
    "contact_channel": "mailto:sales@sklad-vostok.example"
  },
  "modules": {
    "core": { "versions": ["2.1"] },
    "pricing": { "versions": ["1.3"], "level": "L2" },
    "capacity": { "versions": ["2.1"] },
    "order": { "versions": ["0.1"] },
    "billing": { "versions": ["0.1"] }
  },
  "endpoints": {
    "capacity": "https://sklad-vostok.example/fsp/capacity",
    "order": "https://sklad-vostok.example/fsp/v1",
    "billing": "https://sklad-vostok.example/fsp/v1"
  },
  "updated_at": "2026-09-30T10:00:00+03:00"
}
