{
  "fsp": "1.0",
  "party": {
    "role": "operator",
    "id": "sklad",
    "name": "Складсервис",
    "contact_channel": "tg:@sklad_ff"
  },
  "modules": {
    "core": { "versions": ["2.1"] },
    "pricing": { "versions": ["1.3"], "level": "L3" },
    "capacity": { "versions": ["2.1"] }
  },
  "extensions": {
    "x-sklad:route-cutoff-fee": {
      "module": "pricing",
      "versions": ["1.3"],
      "spec": "https://sklad.example/fsp/route-cutoff-fee",
      "candidate_for_standard": true
    }
  },
  "endpoints": {
    "capacity": "https://sklad.example/fsp/capacity"
  },
  "updated_at": "2026-09-30T10:00:00+03:00"
}
